{
  "schema": "relatte.interface-relation.experimental/v0",
  "relation_id": "relation:f681c659",
  "source": "interface:c5c3029a",
  "destination": "interface:7c63c65b",
  "kind": "transform",
  "consumes": "reduced.bytes",
  "produces": "adapter.observation",
  "operation": "observe",
  "preconditions": [],
  "postconditions": [
    "observed"
  ],
  "removes": [],
  "preserves": {
    "bytes": true,
    "semantics": true,
    "ancestry": true,
    "order": true,
    "timing": false,
    "particular_identity": false
  },
  "may_lose": [],
  "reversible": true,
  "loss_cost": 0,
  "requires": {
    "network": false,
    "live_participant": true,
    "local_state": false,
    "witness": null,
    "authority": null
  },
  "binding_ref": "binding:f681c659",
  "verification_ref": "verification:f681c659"
}
