{
  "schema": "relatte.interface-relation.experimental/v0",
  "relation_id": "relation:2c268110",
  "source": "interface:808b5966",
  "destination": "interface:a7bb41d8",
  "kind": "transform",
  "consumes": "payload.bytes",
  "produces": "file.bytes",
  "operation": "observe",
  "preconditions": [],
  "postconditions": [
    "ordered"
  ],
  "removes": [],
  "preserves": {
    "bytes": true,
    "semantics": true,
    "ancestry": true,
    "order": true,
    "timing": false,
    "particular_identity": false
  },
  "may_lose": [],
  "reversible": true,
  "loss_cost": 0,
  "requires": {
    "network": false,
    "live_participant": true,
    "local_state": false,
    "witness": null,
    "authority": "observe"
  },
  "binding_ref": "binding:2c268110",
  "verification_ref": "verification:2c268110"
}
