{
  "schema": "relatte.interface-relation.experimental/v0",
  "relation_id": "relation:f156e960",
  "source": "interface:6e80a889",
  "destination": "interface:e471e59e",
  "kind": "cross",
  "consumes": "adapter.observation",
  "produces": "relatte.observation",
  "operation": "observe",
  "preconditions": [
    "observed"
  ],
  "postconditions": [
    "crossing-verified",
    "receiver-local"
  ],
  "removes": [],
  "preserves": {
    "bytes": true,
    "semantics": true,
    "ancestry": true,
    "order": true,
    "timing": false,
    "particular_identity": false
  },
  "may_lose": [],
  "reversible": true,
  "loss_cost": 0,
  "requires": {
    "network": false,
    "live_participant": true,
    "local_state": false,
    "witness": null,
    "authority": null
  },
  "binding_ref": "binding:f156e960",
  "verification_ref": "verification:f156e960"
}
