{
  "schema": "relatte.interface-relation.experimental/v0",
  "relation_id": "relation:19f077e2",
  "source": "interface:48d87021",
  "destination": "interface:f541ca2d",
  "kind": "observe",
  "consumes": "smf.events",
  "produces": "observed.smf.events",
  "operation": "observe",
  "preconditions": [],
  "postconditions": [
    "event-evidence"
  ],
  "removes": [],
  "preserves": {
    "bytes": true,
    "semantics": true,
    "ancestry": true,
    "order": true,
    "timing": true,
    "particular_identity": false
  },
  "may_lose": [],
  "reversible": true,
  "loss_cost": 0,
  "requires": {
    "network": false,
    "live_participant": true,
    "local_state": false,
    "witness": null,
    "authority": null
  },
  "binding_ref": "binding:19f077e2",
  "verification_ref": "verification:19f077e2"
}
