{
  "schema": "relatte.interface-relation.experimental/v0",
  "relation_id": "relation:6dfa4fbc",
  "source": "interface:a14ff53b",
  "destination": "interface:6b81689c",
  "kind": "transform",
  "consumes": "indexed.fragments",
  "produces": "sent.datagrams",
  "operation": "transmit",
  "preconditions": [
    "indexed"
  ],
  "postconditions": [
    "unordered",
    "duplicates"
  ],
  "removes": [
    "ordered"
  ],
  "preserves": {
    "bytes": true,
    "semantics": true,
    "ancestry": true,
    "order": false,
    "timing": false,
    "particular_identity": false
  },
  "may_lose": [],
  "reversible": true,
  "loss_cost": 0,
  "requires": {
    "network": true,
    "live_participant": true,
    "local_state": false,
    "witness": null,
    "authority": "transmit"
  },
  "binding_ref": "binding:6dfa4fbc",
  "verification_ref": "verification:6dfa4fbc"
}
